;name;city;min_salary;max_salary;company;published_at;min_experience;max_experience;schedule;employment;description;conditions;requirement;responsibility;key_skills
71;Программист;Москва;60000.0;;СТОУН-XXI;2019-11-19T16:29:28+0300;0;0;Полный день;Полная занятость;В связи с развитием корпоративной информационной системы и расширением отдела прикладных разработок мы ищем в IT команду программиста с возможностью приобретения необходимых навыков в процессе работы и последующего включения в состав рабочей группы на сложных проектах. Основные задачи:  Модификация и поддержка модулей программ на VB 6.0 и C#, работающих с MS SQL. Участие в тестировании и запуске новых фич, проектов и приложений. Обработка и анализ баг-репортов.  Необходимые качества:  Хорошие коммуникативные навыки. Здоровый перфекционизм. Внимание к деталям, ответственность, аналитический склад ума, умение справляться с рутиной.  Будет отлично, если вы:  Имеете опыт самостоятельной разработки на VB 6.0, C# или схожих языках. Умеете самостоятельно писать рабочие SQL запросы. Умеете разбираться в чужом коде. Владеете английским языком на уровне чтения технической документации.  Мы предлагаем:  Оформление по ТК, социальные гарантии в полном объеме. Оклад 60 000 рублей после вычета подоходного налога (на руки). Комфортная и доброжелательная атмосфера в команде. Хорошие возможности профессионального роста, сложные задачи. Различные корпоративные активности и спортивные мероприятия. График работы 5/2, гибкое время начала рабочего дня. Офис в 2 минутах пешком от ст.м. «Нагатинская». ;  Оформление по ТК, социальные гарантии в полном объеме. Оклад 60 000 рублей после вычета подоходного налога (на руки). Комфортная и доброжелательная атмосфера в команде. Хорошие возможности профессионального роста, сложные задачи. Различные корпоративные активности и спортивные мероприятия. График работы 5/2, гибкое время начала рабочего дня. Офис в 2 минутах пешком от ст.м. «Нагатинская». ;Хорошие коммуникативные навыки. Здоровый перфекционизм. Внимание к деталям, ответственность, аналитический склад ума, умение справляться с рутиной. Имеете опыт самостоятельной разработки...;Модификация и поддержка модулей программ на VB 6.0 и C#, работающих с MS SQL. Участие в тестировании и запуске...;"MS SQL; Git; SQL; VB 6.0; C#; C++; ASP.NET; PostgreSQL; VBA; Windows Forms"
0;Программист;Екатеринбург;60000.0;;OmniLine;2019-11-20T15:30:31+0300;1;3;Полный день;Полная занятость;О нас: Мы помогаем нашим клиентам становиться лидерами в своих отраслях, повышать качество клиентского сервиса и уровень продаж за счет автоматизации процессов и внедрения лидирующих российских продуктов. Более 10 лет мы занимаемся автоматизацией бизнеса, внедряем контакт-центры, системы IP-телефонии, CRM и Service Desk системы. Автоматизируем продажи, сервис и коммуникации. За плечами несколько сотен проектов для крупных компании по всей России и СНГ. Среди наших клиентов торговые компании, операторы связи, сбытовые компании, сервисные компании, банки, интернет-магазины и другие компании, для которых высокий уровень клиентского сервиса является залогом успеха и лидерства. Мы активно развиваемся и постоянно находимся в поиске опытных профессионалов и начинающих амбициозных специалистов. Работая у нас вы получите возможность полностью реализовать свой потенциал и расти вместе с нами. Наши направления и вендоры: - Контакт-центры и IP-телефония (платформа Oktell) - CRM и Service Desk (платформа BPMOnline) - Чаты и чат-боты (Beesender, Oktell R2, Sherlock) Описание позиции: Программисты в нашей компании это прежде всего команда, нацеленная на решение нестандартных задач. Многие наши клиенты имеют свой штат программистов, но в проектах, которые мы реализуем, часто возникают задачи, которые требуют большей квалификации, навыков, другого мышления и подходов. Именно поэтому программисты важные участники команды внедрения, способные решать такие задачи. Обучение и карьера: Вы начинаете с позиции программиста. Погружаетесь в наши задачи, изучаете продукты, с которыми мы работаем. Далее проходите первую сертификацию на уровень Basic. С этого момента мы полноценно подключаем вас в проекты. Через решение задач и клиентских кейсов вы учитесь и нарабатываете опыт, который позволит вам сертифицироваться на уровень Advanсed и получить позицию ведущего программиста. Стек технологий: С#, SQL (основная работа MS SQL), JavaScript, JSON, XML (желательно WSDL, SOAP), Web-socket, REST API Обязанности: - Разработка нетиповых модулей для интеграции систем. Разработка модулей и конфигурация к программным продуктам   Требования:  хорошие знания C#, JavaScript желательно знание нотации BPMN обязательное знание SQL(начальный уровень) знание сетевых технологий TCP\IP, порты, маршруты и прочее приветствуется работа с Command Line (Windows), PowerShell, Bash SSH, FTP, TFTP, SMB умение работать с сертификатами и ключами шифрованиями личные качества: активность, ответственность, коммуникабельность, ориентация на результат, скрупулезность, умение работать в команде  Условия:  работа в дружном коллективе интересные задачи заработная плата по результатам собеседования и ожидания кандидатов: оклад + премии по результатам работы соц. пакет график пн-пт с 9.00 - 18.00 после трудоустройства проводится обучение ;  работа в дружном коллективе интересные задачи заработная плата по результатам собеседования и ожидания кандидатов: оклад + премии по результатам работы соц. пакет график пн-пт с 9.00 - 18.00 после трудоустройства проводится обучение ;Контакт-центры и IP-телефония (платформа Oktell). Хорошие знания C#, JavaScript. Желательно знание нотации BPMN. Обязательное знание SQL(начальный уровень). ;CRM и Service Desk (платформа BPMOnline). - Чаты и чат-боты (Beesender, Oktell R2, Sherlock). - Разработка нетиповых модулей для интеграции...;"JavaScript; C#; MS SQL; JSON API; SOAP; BPMN"
83;Программист;Москва;85000.0;;Элсиэл;2019-11-19T16:36:35+0300;1;3;Полный день;Полная занятость;Профиль: Промышленная электроника, силовая преобразовательная техника, приборостроение, электроприводы   Обязанности:  Разработка прикладного программного обеспечения по заданным алгоритмам для встроенных систем  Требования:  Высшее образование Приветствуются знания среды разработки и структуры современных микроконтроллеров (ARM, ПЛИС) и сигнальных процессоров (DPS) Приветствуются навыки работы с памятью, GPIO, ЦАП/АЦП, LCD, UART, SPI, I2C, Опыт программирования на языке С/С++ Опыт использования системы контроля версий (GIT) Знание принципов объектно-ориентированного программирования Приветствуются знание Linux, GCC, QT  Условия:  Полный рабочий цель (ПН-ПТ: 9:00-13:00, 14:00-18:00) или (ПН-ПТ: 8:00-13:00, 14:00-17:00) Оформление в соответствии с ТК РФ Оклад + Премии ;  Полный рабочий цель (ПН-ПТ: 9:00-13:00, 14:00-18:00) или (ПН-ПТ: 8:00-13:00, 14:00-17:00) Оформление в соответствии с ТК РФ Оклад + Премии ;Высшее образование. Приветствуются знания среды разработки и структуры современных микроконтроллеров (ARM, ПЛИС) и сигнальных процессоров (DPS). Приветствуются навыки работы с...;Разработка прикладного программного обеспечения по заданным алгоритмам для встроенных систем.;
63;Программист;Москва;100000.0;;БТЕ;2019-11-19T11:33:06+0300;3;6;Удаленная работа;Полная занятость;"  Мы ищем талантливого, программиста с опытом работы и желанием развиваться! Если это про Тебя, тогда - добро пожаловать в наш дружный коллектив! Работать предстоит над большим внутренним проектом - сервис-деском (сервисное обслуживание различного инженерного оборудования).На проекте используются следующие технологии/сервисы: git, mysql, php5-7, cli, js, telegram, yandex.maps, rabbitmq, redis Мы хотим видеть: Знание стэка php7/mysql/javascriptУмение работать с gitБэкенд:- уверенное знание php 7- знание одного из популярных php фреймворков (symfony, yii, laravel и т.д.)Фронтенд:- умение использовать html/css/javascript- знание jqueryБД:- уверенное знание mysql (индексы, джоины, группировка)- умение составлять и профилировать запросыИметь общее представление об api и как с ним работать Мы предлагаем: - Работу в стабильной, динамично развивающейся компании в дружном молодом коллективе;- Работа в офисе первые 2 месяца, далее удаленно- Офис м. Красносельская (7 минут пешком);";" - Работу в стабильной, динамично развивающейся компании в дружном молодом коллективе;- Работа в офисе первые 2 месяца, далее удаленно- Офис м. Красносельская (7 минут пешком);";Мы хотим видеть: Знание стэка php7/mysql/javascript. Умение работать с git. Бэкенд: - уверенное знание php 7. - ;;"PHP; MySQL; JavaScript; CSS; HTML"
37;Программист;Москва;150000.0;;АВАНТИС3Д;2019-11-19T12:58:22+0300;3;6;Полный день;Полная занятость;Кого ищем?  C++ программиста который не забыл университетский курс математики  Над какими задачами нужно работать?  Модернизация кода CAD-системы (портирование на другие ОС). Решение геометрических и стереометрических задач в уникальной предметной области, охватывающей медицину, биомеханику, вычислительные алгоритмы и трехмерную графику. Разработка архитектурных решений для интеграции новых вещей в отлаженные отработанные механизмы  Какие профессиональные навыки нам важны?  Знание С++, STL, Boost, шаблоны проектирования Знание математики и аналитической геометрии Опыт кроссплатформенной разработки, разработки с использованием MFC и Qt будет большим плюсом  Какое высшее образование потребуется?  Техническое образование (инженерное, математическое)  Нужен ли английский?  да, Intermediate  Что еще нам важно в человеке?  Пригодится умение общаться с людьми, четко излагать мысли. Ценим инициативность и энтузиазм.  С какими технологиями придется столкнуться в работе?  C++11, STL, boost, MFC(Qt), Windows, Visual Studio. ;;Знание С++, STL, Boost, шаблоны проектирования. Знание математики и аналитической геометрии. Опыт кроссплатформенной разработки, разработки с использованием MFC и Qt...;Модернизация кода CAD-системы (портирование на другие ОС). Решение геометрических и стереометрических задач в уникальной предметной области, охватывающей медицину, биомеханику...;
17;Программист;Тюмень;;;Тюменский институт нефти и газа;2019-10-31T09:17:40+0300;0;0;Полный день;Полная занятость;"Обязанности:   Участие в полном цикле разработки продукта. Разработка новых модулей программы и рефакторинг существующего кода; Участие в проектировании архитектуры приложения; Тестирование и взаимодействие с пользователями  Требования:   - Знание платформы .Net и языка C#; - Понимание и умение применять принципы ООП, паттерны проектирования; - Уверенная алгоритмическая подготовка и знание основных структур данных; - Умение видеть запахи плохого кода и выполнять рефакторинг кода; - Привычка писать код так, чтобы за него потом не было стыдно спустя год; - Способность разбираться в мегабайтах чужого кода и понимать задумку автора.   Условия:   Ищем разработчика в команду, занимающуюся разработкой софта для нефтегазовой отрасли. Мы пишем программный комплекс, которым пользуются крупные нефтяные компании (Лукойл, Газпром и т.п.).   Плюсом будут: - Опыт работы с git/svn; - Опыт работы с неявными требованиями; - Опыт работы с 2D/3D визуализацией (openGl); - Собственные проекты или участие в opensource.  ";"   Ищем разработчика в команду, занимающуюся разработкой софта для нефтегазовой отрасли. Мы пишем программный комплекс, которым пользуются крупные нефтяные компании (Лукойл, Газпром и т.п.).   Плюсом будут: - Опыт работы с git/svn; - Опыт работы с неявными требованиями; - Опыт работы с 2D/3D визуализацией (openGl); - Собственные проекты или участие в opensource.  ";Знание платформы .Net и языка C#. - Понимание и умение применять принципы ООП, паттерны проектирования. - Уверенная алгоритмическая подготовка и знание основных...;Участие в полном цикле разработки продукта. Разработка новых модулей программы и рефакторинг существующего кода. Участие в проектировании архитектуры приложения. ;
95;Программист;Москва;;;Reed Exhibitions;2019-11-19T17:19:31+0300;3;6;Полный день;Полная занятость;"В международную компанию Reed Exhibitions (один из лидеров выставочной индустрии в мире) требуется: Программист Основные задачи:  разработка системы регистрации участников выставок и конференционных программ; разработка системы виртуальных кабинетов для участников выставки; построение необходимых интерфейсов с внешними системами.  Основные функции:  постановка задачи через собеседование с пользователями и руководителем; разработка структуры данных и сценариев их обработки; построение тестовых наборов и выработка критериев приемки; разработка приложений и интерфейсов в виде блок-схемы и/или псевдокода; документирование приложений и интерфейсов; создание прозрачного, масштабируемого и re-usable кода поддержание контакта с центром обработки данных в Великобритании по вопросам неисправностей, обновлений ПО, безопасности, проектным вопросам; повседневная нагрузка IT.  Требования:  структурное мышление, способность разбивать проект на подзадачи, навык разрабатывать или находить алгоритмы прежде написания кода; знание и опыт использования MVC; владение PHP (знание других ОО языков приветствуется); навык написания прозрачного, масштабируемого кода и документации обязателен; умение создавать SQL запросы, знание принципов работы RDBMS; умение читать и понимать Java-script, html5, css3, вносить незначительные изменения; образование в сфере IT, предпочтительно прикладная математика; навыки корректного и дружественного общения по телефону и внутри офиса обязательны; организованность, способность работать с отчетностью и выполнять административные функции, навык работы с документацией на английском языке; готовность показать рабочий проект и часть кода, на котором он работает.  Условия:   стабильная официальная заработная плата; оплата мобильной связи, ноутбук, доплата на питание; лицензионный инструментарий; соблюдение ТК РФ, офис в БЦ класса А в районе ст. м. Курская или Чкаловская (3 мин. пешком). ";"   стабильная официальная заработная плата; оплата мобильной связи, ноутбук, доплата на питание; лицензионный инструментарий; соблюдение ТК РФ, офис в БЦ класса А в районе ст. м. Курская или Чкаловская (3 мин. пешком). ";Структурное мышление, способность разбивать проект на подзадачи, навык разрабатывать или находить алгоритмы прежде написания кода. Знание и опыт использования MVC. ;Разработка системы регистрации участников выставок и конференционных программ. Разработка системы виртуальных кабинетов для участников выставки. Построение необходимых интерфейсов с внешними...;"Программирование; PHP; HTML5; SQL; CSS3; ООП; JavaScript"
